review_id,product_name,rating,review_title,review_body,verified_purchase,review_date
R101,AuraStream Wireless Headphones,5,Best sound quality!,The noise cancellation is a game changer for my commute.,True,2023-10-01
R102,AuraStream Wireless Headphones,4,Solid battery life,Lasts about 30 hours on a single charge as advertised.,True,2023-10-05
R103,AuraStream Wireless Headphones,2,Uncomfortable for long use,The ear cups are a bit tight and start to hurt after an hour.,False,2023-10-12
R104,AuraStream Wireless Headphones,5,Sleek design and easy setup,Pairs instantly with my phone. The matte finish looks premium.,True,2023-10-15
R105,AuraStream Wireless Headphones,3,Decent but pricey,"The audio is crisp, but I feel like I paid more for the brand name.",True,2023-10-20
